"77","Hippocampus bargibanti","Hippocampus","bargibanti",30915,"Whitley, 1970","Pygmy seahorse","Hibar_u4.jpg",NA,NA,NA,258,"Hippocampinae",5566,NA,"other","R",NA,NA,0,0,0,-1,"reef-associated","non-migratory",NA,16,40,30915,NA,NA,NA,NA,NA,NA,NA,10,2.4,"OT",NA,NA,31803,NA,NA,NA,NA,NA,NA,NA,NA,NA,NA,NA,NA,NA,"of no interest","unknown",NA,NA,NA,NA,NA,NA,0,0,0,0,0,0,0,0,0,0,"never/rarely",NA,NA,"never/rarely",NA,"never/rarely",NA,NA,0,NA,"harmless",NA,"no special ability",NA,NA,-1,"Only known to occur on gorgonian corals of the genus <i>Muricella</i>, with up to 28 pairs on a single gorgonian.  The tubercles and truncated snout of this species match the color and shape of the polyps of the host gorgonian, while its body matches the gorgonian stem.  So extreme is this camouflage that the original specimens were only noticed after their host gorgonian had been collected and observed in an aquarium.  Post-pelagic young settle on various hosts, but to breed, they appear to prefer the red polyp <i>Muricella</i> spp. That usually grow in depths over 20 m (Ref. 48635).  Ovoviviparous (Ref. 205).  The male carries the eggs in a brood pouch which is found under the tail (Ref. 205).",NA,0.5,0,1,"1999-08-17T00:00:00.000Z",2,"2005-01-17T00:00:00.000Z",1,"2000-01-18T00:00:00.000Z",NA,53790
"78","Hippocampus borboniensis","Hippocampus","borboniensis",30915,"Duméril, 1870","Réunion seahorse","Hibor_f0.jpg",NA,NA,NA,258,"Hippocampinae",5566,NA,"other","R",NA,NA,0,0,0,-1,"demersal","non-migratory",NA,NA,60,52034,NA,NA,NA,NA,NA,NA,NA,10.53,14,"OT",NA,NA,30915,NA,NA,NA,NA,NA,NA,NA,NA,NA,NA,NA,NA,NA,"of potential interest","unknown",NA,NA,NA,NA,NA,NA,0,0,0,0,0,0,0,0,0,0,"never/rarely",NA,NA,"never/rarely",NA,"never/rarely",NA,NA,0,NA,"harmless",NA,"no special ability",NA,NA,-1,"Length type is height (=TL - head length).  Found in seagrass beds.  Ovoviviparous (Ref. 205).  The male carries the eggs in a brood pouch which is found under the tail (Ref. 205).",NA,0.5,0,1,"1999-08-17T00:00:00.000Z",2,"2005-02-15T00:00:00.000Z",NA,NA,NA,53791
"79","Hippocampus comes","Hippocampus","comes",30915,"Cantor, 1849","Tiger tail seahorse","Hicom_f0.jpg",NA,NA,NA,258,"Hippocampinae",5566,NA,"other","R",NA,NA,0,0,0,-1,"reef-associated","non-migratory",NA,15,30,90102,NA,NA,NA,NA,NA,NA,NA,10,18.7,"OT",NA,NA,52034,NA,NA,NA,NA,NA,NA,NA,NA,NA,NA,NA,NA,30915,"commercial","unknown",NA,NA,NA,NA,NA,NA,0,0,0,0,0,0,0,0,0,0,"never/rarely",NA,NA,"never/rarely",NA,"commercial","based mainly on capture",NA,0,NA,"harmless",NA,"no special ability",NA,NA,-1,"Length type refers to Height (= from top of coronet to the tip of straightened tail).  This species is mainly found in pairs (Ref. 48635) on coral reefs, sponge gardens, kelp, and floating <i>Sargassum</i>.  Nocturnal, site faithful.  Feeds on zooplankton (Ref. 85309).  Ovoviviparous (Ref. 205).  The male carries the eggs in a brood pouch which is found under the tail (Ref. 205).  Life span probably more than 2-3 years.  Used for traditional Chinese medicine (Ref. 85309).",NA,0.5,0,1,"1999-08-17T00:00:00.000Z",10,"2013-02-28T00:00:00.000Z",NA,NA,NA,53792
"80","Hippocampus fisheri","Hippocampus","fisheri",30915,"Jordan & Evermann, 1903","Fisher's seahorse","Hifis_m0.jpg",NA,NA,NA,258,"Hippocampinae",5566,NA,"other","R",NA,NA,0,0,0,-1,"demersal","non-migratory",NA,0,NA,NA,NA,NA,NA,NA,NA,NA,NA,10.53,8,"OT",NA,NA,30915,NA,NA,NA,NA,NA,NA,NA,NA,NA,NA,NA,NA,NA,"of no interest","unknown",NA,NA,NA,NA,NA,NA,0,0,0,0,0,0,0,0,0,0,"never/rarely",NA,NA,"never/rarely",NA,"never/rarely",NA,NA,0,NA,"harmless",NA,"no special ability",NA,NA,-1,"Length type refers to Height (= from tip of coronet to the tip of straightened tail).  Ovoviviparous (Ref. 205).  The male carries the eggs in a brood pouch which is found under the tail (Ref. 205).",NA,0.5,0,1,"1999-08-20T00:00:00.000Z",10,"2005-02-07T00:00:00.000Z",NA,NA,NA,53803
"81","Hippocampus jayakari","Hippocampus","jayakari",30915,"Boulenger, 1900","Jayakar's seahorse","Hijay_m0.jpg",NA,NA,NA,258,"Hippocampinae",5566,NA,"other","R",NA,NA,0,0,0,-1,"demersal","non-migratory",NA,NA,20,52034,2,3,30915,NA,NA,NA,NA,10.53,14,"OT",NA,NA,45091,NA,NA,NA,NA,NA,NA,NA,NA,NA,NA,NA,NA,NA,NA,"unknown",NA,NA,NA,NA,NA,NA,0,0,0,0,0,0,0,0,0,0,"never/rarely",NA,NA,"never/rarely",NA,"never/rarely",NA,NA,0,NA,"harmless",NA,"no special ability",NA,NA,-1,"Found in seagrass beds, e.g. <i>Halophila</i> spp.  Ovoviviparous (Ref. 205).  The male carries the eggs in a brood pouch which is found under the tail (Ref. 205).",NA,0.5,0,1,"1999-08-24T00:00:00.000Z",2,"2005-02-16T00:00:00.000Z",NA,NA,NA,53814
"82","Hippocampus kelloggi","Hippocampus","kelloggi",30915,"Jordan & Snyder, 1901","Great seahorse","Hikel_m0.jpg",NA,NA,NA,258,"Hippocampinae",5566,NA,"other","R",NA,NA,0,0,0,-1,"bathydemersal","non-migratory",NA,NA,120,52034,NA,NA,NA,NA,NA,NA,NA,10.53,28,"OT",NA,NA,45091,NA,NA,NA,NA,NA,NA,NA,NA,NA,NA,NA,NA,NA,NA,"unknown",NA,NA,NA,NA,NA,NA,0,0,0,0,0,0,0,0,0,0,"never/rarely",NA,NA,"never/rarely",NA,"never/rarely",NA,NA,0,NA,"harmless",NA,"no special ability",NA,NA,-1,"Deep water species, associated with corals (Ref. 52034).  Ovoviviparous (Ref. 205).  The male carries the eggs in a brood pouch which is found under the tail (Ref. 205).",NA,0.5,0,1,"1999-08-24T00:00:00.000Z",2,"2005-02-16T00:00:00.000Z",NA,NA,NA,53815
"83","Hippocampus lichtensteinii","Hippocampus","lichtensteinii",30915,"Kaup, 1856","Lichtenstein's Seahorse","Hilic_f0.jpg",NA,NA,NA,258,"Hippocampinae",5566,NA,"other","R",NA,NA,0,0,0,-1,"demersal","non-migratory",NA,NA,NA,NA,NA,NA,NA,NA,NA,NA,NA,10,4,"OT",NA,NA,30915,NA,NA,NA,NA,NA,NA,NA,NA,NA,NA,NA,NA,NA,NA,"unknown",NA,NA,NA,NA,NA,NA,0,0,0,0,0,0,0,0,0,0,"never/rarely",NA,NA,"never/rarely",NA,"never/rarely",NA,NA,0,NA,"harmless",NA,"no special ability",NA,NA,-1,"Length type refers to height.  Ovoviviparous (Ref. 205).  The male carries the eggs in a brood pouch which is found under the tail (Ref. 205).",NA,0.5,0,1,"1999-09-09T00:00:00.000Z",2,"2004-11-23T00:00:00.000Z",NA,NA,NA,53909
"84","Hippocampus minotaur","Hippocampus","minotaur",30915,"Gomon, 1997","Bullneck seahorse","Himin_f0.jpg",NA,NA,NA,258,"Hippocampinae",5566,NA,"other","R",NA,NA,0,0,0,-1,"reef-associated","non-migratory",NA,64,100,30915,NA,NA,NA,NA,NA,NA,NA,10,5,"OT",NA,NA,30915,NA,NA,NA,NA,NA,NA,NA,NA,NA,NA,NA,NA,NA,NA,"unknown",NA,NA,NA,NA,NA,NA,0,0,0,0,0,0,0,0,0,0,"never/rarely",NA,NA,"never/rarely",NA,"never/rarely",NA,NA,0,NA,"harmless",NA,"no special ability",NA,NA,-1,"Found on the continental shelf (Ref. 75154).  Trawled from fine sand or hard bottom, possibly in association with gorgonian coral (Ref. 205).  Benthic species (Ref. 75154).  Ovoviviparous (Ref. 205).  The male carries the eggs in a brood pouch which is found under the tail (Ref. 205).",NA,0.5,0,1,"1999-09-10T00:00:00.000Z",1472,"2008-11-05T00:00:00.000Z",NA,NA,NA,53910
"85","Hippocampus mohnikei","Hippocampus","mohnikei",30915,"Bleeker, 1853","Japanese seahorse","Himoh_m1.jpg",NA,NA,NA,258,"Hippocampinae",5566,NA,"other","R",NA,NA,0,0,0,-1,"demersal","non-migratory",NA,1,NA,30915,NA,NA,NA,NA,NA,NA,NA,14.58,8,"OT",NA,NA,30915,5,"OT",NA,NA,30915,NA,NA,NA,NA,NA,NA,NA,NA,NA,"unknown",NA,NA,NA,NA,NA,NA,0,0,0,0,0,0,0,0,0,0,"never/rarely",NA,NA,"never/rarely",NA,"never/rarely",NA,NA,0,NA,"harmless",NA,"no special ability",NA,NA,-1,"In <i>Zostera</i> seagrass beds; also in estuaries.  Length type refers to height (= TL - head length).  Ovoviviparous (Ref. 205).  The male carries the eggs in a brood pouch which is found under the tail (Ref. 205).",NA,0.5,0,1,"1999-09-10T00:00:00.000Z",14,"2007-07-25T00:00:00.000Z",NA,NA,NA,53911
"86","Hippocampus subelongatus","Hippocampus","subelongatus",30915,"Castelnau, 1873","West Australian seahorse","Hisub_u0.jpg",NA,NA,NA,258,"Hippocampinae",5566,NA,"other","R",NA,NA,0,0,-1,-1,"demersal","non-migratory",NA,1,25,30915,NA,NA,NA,NA,NA,NA,NA,10.53,20,"OT",NA,NA,30915,NA,NA,NA,NA,NA,NA,NA,NA,NA,NA,NA,NA,NA,NA,"unknown",NA,NA,NA,NA,NA,NA,0,0,0,0,0,0,0,0,0,0,"never/rarely",NA,NA,"never/rarely",NA,"never/rarely",NA,NA,0,NA,"harmless",NA,"no special ability",NA,NA,-1,"Found on edge of rocky areas, muddy bottom and areas of high sediment load; jetty piles and moorings; often associated with sponges or sea squirts or attached to man-made objects; moves to deeper waters in winter.  Ovoviviparous (Ref. 205).  The male carries the eggs in a brood pouch which is found under the tail (Ref. 205).  This species manifested evidence of genetically monogamous character in seahorses (Ref. 59213).  Site fidelity is observed during breeding season (Ref. 59213).  Length type refers to height (= TL - head length) (Ref. 30915).",NA,0.5,0,1,"1999-09-10T00:00:00.000Z",2,"2009-05-25T00:00:00.000Z",NA,NA,NA,53914
"87","Scaphirhynchus suttkusi","Scaphirhynchus","suttkusi",33977,"Williams & Clemmer, 1991","Alabama sturgeon","Scsut_u0.jpg",NA,NA,NA,32,"Scaphirhynchinae",2550,NA,"elongated","R",NA,NA,0,-1,-1,-1,"demersal","anadromous",33977,NA,NA,NA,NA,NA,NA,NA,NA,NA,NA,83.47,NA,NA,NA,NA,NA,NA,NA,NA,NA,NA,NA,NA,NA,NA,NA,NA,NA,NA,NA,"unknown",NA,NA,NA,NA,"","",0,0,0,0,0,0,0,0,0,0,"never/rarely","",NA,"never/rarely",NA,"never/rarely","",NA,0,NA,"harmless",NA,"no special ability",NA,NA,-1,NA,NA,0.625,0,14,"2000-05-03T00:00:00.000Z",2,"2007-10-02T00:00:00.000Z",NA,NA,NA,56264
"88","Hippocampus jugumus","Hippocampus","jugumus",42735,"Kuiter, 2001","Collared seahorse",NA,NA,NA,NA,258,"Hippocampinae",5566,NA,"other","R",NA,NA,0,0,0,-1,"pelagic-neritic","non-migratory",NA,NA,NA,NA,NA,NA,NA,NA,NA,NA,NA,10,4.4,"OT",NA,NA,42735,NA,NA,NA,NA,NA,NA,NA,NA,NA,NA,NA,NA,NA,NA,"unknown",NA,NA,NA,NA,NA,NA,0,0,0,0,0,0,0,0,0,0,"never/rarely",NA,NA,"never/rarely",NA,"never/rarely",NA,NA,0,NA,"harmless",NA,"no special ability",NA,NA,-1,"Probably pelagic (Ref. 42735).  Maximum length is based on a straight-line length measurement from upper surface (ignoring spines) of first trunk ring, to tip of tail (Ref. 42735).  Ovoviviparous (Ref. 205).  The male carries the eggs in a brood pouch which is found under the tail (Ref. 205).",NA,0.5,0,113,"2002-07-15T00:00:00.000Z",2,"2008-09-22T00:00:00.000Z",NA,NA,NA,59700
"89","Hippocampus biocellatus","Hippocampus","biocellatus",42735,"Kuiter, 2001","False-eyed seahorse",NA,NA,NA,NA,258,"Hippocampinae",5566,NA,"other","R",NA,NA,0,0,0,-1,"demersal","non-migratory",NA,0,20,42735,NA,NA,NA,NA,NA,NA,NA,10.53,10.8,"OT",NA,NA,42735,NA,NA,NA,NA,NA,NA,NA,NA,NA,NA,NA,NA,NA,NA,"unknown",NA,NA,NA,NA,NA,NA,0,0,0,0,0,0,0,0,0,0,"never/rarely",NA,NA,"never/rarely",NA,"never/rarely",NA,NA,0,NA,"harmless",NA,"no special ability",NA,NA,-1,"Adults inhabit shallow algae or weedy reef areas from the intertidal to about 20 m depth (Ref. 42735).  Maximum length is based on a straight-line length measurement from upper surface (ignoring spines) of first trunk ring, to tip of tail (Ref. 42735).  Ovoviviparous (Ref. 205).  The male carries the eggs in a brood pouch which is found under the tail (Ref. 205).",NA,0.5,0,113,"2002-07-15T00:00:00.000Z",2,"2011-07-08T00:00:00.000Z",NA,NA,NA,59701
"90","Hippocampus alatus","Hippocampus","alatus",42735,"Kuiter, 2001","Winged seahorse","Hiala_u0.jpg",NA,NA,NA,258,"Hippocampinae",5566,NA,"other","R",NA,NA,0,0,0,-1,"demersal","non-migratory",NA,10,80,42735,NA,NA,NA,NA,NA,NA,NA,10.53,11.7,"OT",13.6,"OT",42735,NA,NA,NA,NA,NA,NA,NA,NA,NA,NA,NA,NA,NA,NA,"unknown",NA,NA,NA,NA,NA,NA,0,0,0,0,0,0,0,0,0,0,"never/rarely",NA,NA,"never/rarely",NA,"never/rarely",NA,NA,0,NA,"harmless",NA,"no special ability",NA,NA,-1,"Adults inhabit soft bottom (Ref. 42735, 75154) of the continental shelf (Ref. 75154).  Maximum length is based on a straight-line length measurement from upper surface (ignoring spines) of first trunk ring, to tip of tail (Ref. 42735).  Ovoviviparous (Ref. 205).  The male carries the eggs in a brood pouch which is found under the tail (Ref. 205).",NA,0.5,0,113,"2002-07-15T00:00:00.000Z",2,"2011-07-08T00:00:00.000Z",NA,NA,NA,59702
"91","Hippocampus semispinosus","Hippocampus","semispinosus",42735,"Kuiter, 2001","Half-spined seahorse",NA,NA,NA,NA,258,"Hippocampinae",5566,NA,"other","R",NA,NA,0,0,0,-1,"demersal","non-migratory",NA,40,60,58018,NA,NA,NA,NA,NA,NA,NA,10.53,18,"OT",NA,NA,48635,NA,NA,NA,NA,NA,NA,NA,NA,NA,NA,NA,NA,NA,NA,"unknown",NA,NA,NA,NA,NA,NA,0,0,0,0,0,0,0,0,0,0,"never/rarely",NA,NA,"never/rarely",NA,"never/rarely",NA,NA,0,NA,"harmless",NA,"no special ability",NA,NA,-1,"Found on shallow coastal habitats, from near mangroves to deeper muddy channels, or deep offshore where known from trawls (Ref. 48635).  Often with algae growth on the spiny ridges (Ref. 48635).  Ovoviviparous (Ref. 205).  The male carries the eggs in a brood pouch which is found under the tail (Ref. 205).",NA,0.5,0,113,"2002-07-15T00:00:00.000Z",113,"2008-07-14T00:00:00.000Z",NA,NA,NA,59703
"92","Hippocampus montebelloensis","Hippocampus","montebelloensis",42735,"Kuiter, 2001","Monte Bello seahorse",NA,NA,NA,NA,258,"Hippocampinae",5566,NA,"other","R",NA,NA,0,0,0,-1,"pelagic-neritic","non-migratory",NA,NA,NA,NA,NA,NA,NA,NA,NA,NA,NA,10.53,NA,NA,7.8,"OT",42735,NA,NA,NA,NA,NA,NA,NA,NA,NA,NA,NA,NA,NA,NA,"unknown",NA,NA,NA,NA,NA,NA,0,0,0,0,0,0,0,0,0,0,"never/rarely",NA,NA,"never/rarely",NA,"never/rarely",NA,NA,0,NA,"harmless",NA,"no special ability",NA,NA,-1,"Found on the continental shelf (Ref. 75154).  Holotype caught at the surface, clinging to <i>Sargassum</i> fragment (Ref. 42735).  Maximum length is based on a straight-line length measurement from upper surface (ignoring spines) of first trunk ring, to tip of tail (Ref. 42735).  Ovoviviparous (Ref. 205).  The male carries the eggs in a brood pouch which is found under the tail (Ref. 205).",NA,0.5,0,113,"2002-07-15T00:00:00.000Z",1472,"2008-11-05T00:00:00.000Z",NA,NA,NA,59704
"93","Hippocampus procerus","Hippocampus","procerus",42735,"Kuiter, 2001","High-crown seahorse","Hipro_u1.jpg",NA,NA,NA,258,"Hippocampinae",5566,NA,"other","R",NA,NA,0,0,0,-1,"demersal","non-migratory",NA,0,20,42735,NA,NA,NA,NA,NA,NA,NA,10.53,NA,NA,11,"OT",42735,NA,NA,NA,NA,NA,NA,NA,NA,NA,NA,NA,NA,NA,NA,"unknown",NA,NA,NA,NA,NA,NA,0,0,0,0,0,0,0,0,0,0,"never/rarely",NA,NA,"never/rarely",NA,"never/rarely",NA,NA,0,NA,"harmless",NA,"no special ability",NA,NA,-1,"Occurs on mixed algae reef (Ref. 42735) of the continental shelf (Ref. 75154).  Maximum length is based on a straight-line length measurement from upper surface (ignoring spines) of first trunk ring, to tip of tail (Ref. 42735).  Ovoviviparous (Ref. 205).  The male carries the eggs in a brood pouch which is found under the tail (Ref. 205).",NA,0.5,0,113,"2002-07-15T00:00:00.000Z",1472,"2008-11-05T00:00:00.000Z",NA,NA,NA,59705
"94","Hippocampus multispinus","Hippocampus","multispinus",42735,"Kuiter, 2001","Northern spiny seahorse",NA,NA,NA,NA,258,"Hippocampinae",5566,NA,"other","R",NA,NA,0,0,0,-1,"demersal","non-migratory",NA,12,60,42735,20,60,42735,NA,NA,NA,NA,10.53,14,"OT",NA,NA,42735,NA,NA,NA,NA,NA,NA,NA,NA,NA,NA,NA,NA,NA,NA,"unknown",NA,NA,NA,NA,NA,NA,0,0,0,0,0,0,0,0,0,0,"never/rarely",NA,NA,"never/rarely",NA,"never/rarely",NA,NA,0,NA,"harmless",NA,"no special ability",NA,NA,-1,"Found on the continental shelf (Ref. 75154).  Probably inhabiting more weedy areas (Ref. 42735).  Maximum length is based on a straight-line length measurement from upper surface (ignoring spines) of first trunk ring, to tip of tail (Ref. 42735).  Ovoviviparous (Ref. 205).  The male carries the eggs in a brood pouch which is found under the tail (Ref. 205).",NA,0.5,0,113,"2002-07-15T00:00:00.000Z",1472,"2008-11-05T00:00:00.000Z",NA,NA,NA,59706
"95","Hippocampus hendriki","Hippocampus","hendriki",42735,"Kuiter, 2001","Eastern spiny seahorse",NA,NA,NA,NA,258,"Hippocampinae",5566,NA,"other","R",NA,NA,0,0,0,-1,"demersal","non-migratory",NA,16,25,42735,NA,NA,NA,NA,NA,NA,NA,10.53,NA,NA,10.4,"OT",42735,NA,NA,NA,NA,NA,NA,NA,NA,NA,NA,NA,NA,NA,NA,"unknown",NA,NA,NA,NA,NA,NA,0,0,0,0,0,0,0,0,0,0,"never/rarely",NA,NA,"never/rarely",NA,"never/rarely",NA,NA,0,NA,"harmless",NA,"no special ability",NA,NA,-1,"Occurs over soft bottom of the continental shelf (Ref. 75154).  Maximum length is based on a straight-line length measurement from upper surface (ignoring spines) of first trunk ring, to tip of tail (Ref. 42735).  Ovoviviparous (Ref. 205).  The male carries the eggs in a brood pouch which is found under the tail (Ref. 205).  Minimum depth from Ref. 58018.",NA,0.5,0,113,"2002-07-19T00:00:00.000Z",1472,"2008-11-05T00:00:00.000Z",NA,NA,NA,59707
"96","Hippocampus grandiceps","Hippocampus","grandiceps",42735,"Kuiter, 2001","Big-head seahorse",NA,NA,NA,NA,258,"Hippocampinae",5566,NA,"other","R",NA,NA,0,0,0,-1,"demersal","amphidromous",NA,NA,10,58018,NA,NA,NA,NA,NA,NA,NA,10.53,NA,NA,10.5,"OT",42735,NA,NA,NA,NA,NA,NA,NA,NA,NA,NA,NA,NA,NA,NA,"unknown",NA,NA,NA,NA,NA,NA,0,0,0,0,0,0,0,0,0,0,"never/rarely",NA,NA,"never/rarely",NA,"never/rarely",NA,NA,0,NA,"harmless",NA,"no special ability",NA,NA,-1,"Collected from shallow water (Ref. 42735).  Maximum length is based on a straight-line length measurement from upper surface (ignoring spines) of first trunk ring, to tip of tail (Ref. 42735).  Ovoviviparous (Ref. 205).  The male carries the eggs in a brood pouch which is found under the tail (Ref. 205).",NA,0.5,0,113,"2002-07-19T00:00:00.000Z",113,"2008-07-14T00:00:00.000Z",NA,NA,NA,59708
"97","Hippocampus denise","Hippocampus","denise",47053,"Lourie & Randall, 2003","Denise's pygmy seahorse","Hiden_u2.jpg",NA,NA,NA,258,"Hippocampinae",5566,NA,"other","O",NA,NA,0,0,0,-1,"reef-associated","non-migratory",NA,13,90,47053,NA,NA,NA,NA,NA,NA,NA,10,2.15,"SL",2.4,"SL",47053,NA,NA,NA,NA,NA,NA,NA,NA,NA,NA,NA,NA,NA,NA,"unknown",NA,NA,NA,NA,NA,NA,0,0,0,0,0,0,0,0,0,0,"never/rarely",NA,NA,"never/rarely",NA,"never/rarely",NA,NA,0,NA,"harmless",NA,"no special ability",NA,NA,-1,"Lives in association with gorgonian seafans (<i>Annella reticulata</i>, <i>Muricella</i> sp., and <i>Echinogorgia</i> sp.).  Master of camouflage, with their coloration and body ornamentation in the form of tubercles, can match the stems and polyps of their gorgonian hosts (Ref. 47053).  Ovoviviparous (Ref. 205).  The male carries the eggs in a brood pouch which is found under the tail (Ref. 205).",NA,0.5,0,14,"2003-05-22T00:00:00.000Z",2,"2005-02-16T00:00:00.000Z",NA,NA,NA,60329
"98","Hippocampus queenslandicus","Hippocampus","queenslandicus",42735,"Horne, 2001","Queensland seahorse",NA,NA,NA,NA,258,"Hippocampinae",5566,NA,"other","R",NA,NA,0,0,0,-1,"reef-associated","non-migratory",NA,20,63,42735,NA,NA,NA,NA,NA,NA,NA,10.53,11.6,"OT",NA,NA,48635,NA,NA,NA,NA,NA,NA,NA,NA,NA,NA,NA,NA,NA,NA,"unknown",NA,NA,NA,NA,NA,NA,0,0,0,0,0,0,0,0,0,0,"never/rarely",NA,NA,"never/rarely",NA,"never/rarely",NA,NA,0,NA,"harmless",NA,"no special ability",NA,NA,-1,"Inhabits rubble bottom and seagrass of the continental shelf (Ref. 75154).  Maximum length is based on a straight-line length measurement from upper surface (ignoring spines) of first trunk ring, to tip of tail (Ref. 42735).  Ovoviviparous (Ref. 205).  The male carries the eggs in a brood pouch which is found under the tail (Ref. 205).  Taken in trawls (Ref. 42735).",NA,0.5,0,113,"2003-10-07T00:00:00.000Z",1472,"2008-11-05T00:00:00.000Z",NA,NA,NA,61281
"99","Hippocampus colemani","Hippocampus","colemani",50838,"Kuiter, 2003","Coleman's pygmy seahorse","Hicol_u0.jpg",NA,NA,NA,258,"Hippocampinae",5566,NA,"other","O",NA,NA,0,0,0,-1,"demersal","non-migratory",NA,4,12,90102,NA,NA,NA,NA,NA,NA,NA,10,2.65,"SL",NA,NA,79848,NA,NA,NA,NA,NA,NA,NA,NA,NA,NA,NA,NA,NA,NA,"unknown",NA,NA,NA,NA,NA,NA,0,0,0,0,0,0,0,0,0,0,"never/rarely",NA,NA,"never/rarely",NA,"never/rarely",NA,NA,0,NA,"harmless",NA,"no special ability",NA,NA,-1,"Ovoviviparous (Ref. 205).  The male carries the eggs in a brood pouch which is found under the tail (Ref. 205). Found in sand bottoms with sparse <i>Zostera</i> and <i>Halophilia</i> in 4-12 m (Ref 90102).",NA,0.5,0,10,"2004-05-17T00:00:00.000Z",2291,"2013-07-22T00:00:00.000Z",NA,NA,NA,61638
"100","Hippocampus patagonicus","Hippocampus","patagonicus",56787,"Piacentino & Luzzatto, 2004",NA,"Hipat_u0.jpg",NA,NA,NA,258,"Hippocampinae",5566,NA,"other","O",NA,NA,0,0,0,-1,"benthopelagic","non-migratory",NA,NA,NA,NA,NA,NA,NA,NA,NA,NA,NA,10,NA,NA,NA,NA,NA,NA,NA,NA,NA,NA,NA,NA,NA,NA,NA,NA,NA,NA,NA,"unknown",NA,NA,NA,NA,NA,NA,0,0,0,0,0,0,0,0,0,0,"never/rarely",NA,NA,"never/rarely",NA,"never/rarely",NA,NA,0,NA,"harmless",NA,"no special ability",NA,NA,-1,NA,NA,0.5,0,14,"2006-10-27T00:00:00.000Z",NA,"2006-10-27T00:00:00.000Z",NA,NA,NA,62875
"101","Hippocampus waleananus","Hippocampus","waleananus",80667,"Gomon & Kuiter, 2009","Walea pygmy seahorse","Hiwal_u1.jpg",NA,NA,NA,258,"Hippocampinae",5566,NA,"other","O",NA,NA,0,0,0,-1,"benthopelagic","non-migratory",NA,NA,NA,NA,5,20,80667,NA,NA,NA,NA,10,1.78,"SL",NA,NA,80667,NA,NA,NA,NA,NA,NA,NA,NA,NA,NA,NA,NA,NA,NA,NA,NA,NA,"",NA,"","",0,0,0,0,0,0,0,0,0,0,"never/rarely","",NA,"never/rarely",NA,"never/rarely","",NA,0,NA,"harmless",NA,"no special ability",NA,NA,-1,"Occurs on <i>Nepthea</i> soft coral in 5-20 m (Ref 90102).",NA,0.5,0,1016,"2009-03-31T16:34:02.000Z",2291,"2013-02-28T00:00:00.000Z",NA,NA,NA,64901
"102","Hippocampus debelius","Hippocampus","debelius",80667,"Gomon & Kuiter, 2009","Softcoral seahorse",NA,NA,NA,NA,258,"Hippocampinae",5566,NA,"other","O",NA,NA,0,0,0,-1,"reef-associated","non-migratory",NA,NA,NA,NA,15,30,80667,NA,NA,NA,NA,10,2.37,"SL",NA,NA,80667,NA,NA,NA,NA,NA,NA,NA,NA,NA,NA,NA,NA,NA,NA,NA,NA,NA,"",NA,"","",0,0,0,0,0,0,0,0,0,0,"never/rarely","",NA,"never/rarely",NA,"never/rarely","",NA,0,NA,"harmless",NA,"no special ability",NA,NA,-1,NA,NA,0.5,0,1016,"2009-04-01T19:30:11.000Z",303,"2009-04-22T00:00:00.000Z",NA,NA,NA,64902
"103","Hippocampus curvicuspis","Hippocampus","curvicuspis",75989,"Fricke, 2004","New Caledonian thorny seahorse","Hicur_u0.jpg",NA,NA,NA,258,"Hippocampinae",5566,NA,"other","O",NA,NA,0,0,0,-1,"demersal","non-migratory",NA,6,20,86942,NA,NA,NA,NA,NA,NA,NA,10,NA,NA,9.76,"SL",75989,NA,NA,NA,NA,NA,NA,NA,NA,NA,NA,NA,NA,NA,NA,NA,NA,NA,NA,NA,NA,NA,0,0,0,0,0,0,0,0,0,0,"never/rarely",NA,NA,"never/rarely",NA,"never/rarely",NA,NA,0,NA,"harmless",NA,"no special ability",NA,NA,-1,"Found in seagrass beds at depths of more than 6 meters (Ref. 75989).",NA,0.5,0,14,"2008-11-21T00:00:00.000Z",2291,"2015-04-17T00:00:00.000Z",NA,NA,NA,64769
"104","Hippocampus pusillus","Hippocampus","pusillus",75989,"Fricke, 2004","Pygmy thorny seahorse",NA,NA,NA,NA,258,"Hippocampinae",5566,NA,"other","O",NA,NA,0,0,0,-1,"reef-associated","non-migratory",NA,35,228,75989,NA,NA,NA,NA,NA,NA,NA,10,NA,NA,NA,NA,75989,NA,NA,NA,NA,NA,NA,NA,NA,NA,NA,NA,NA,NA,NA,NA,NA,NA,NA,NA,NA,NA,0,0,0,0,0,0,0,0,0,0,"never/rarely",NA,NA,"never/rarely",NA,"never/rarely",NA,NA,0,NA,"harmless",NA,"no special ability",NA,NA,-1,NA,NA,0.5,0,14,"2008-11-21T00:00:00.000Z",NA,"2008-11-21T00:00:00.000Z",NA,NA,NA,64770
"105","Hippocampus pontohi","Hippocampus","pontohi",79848,"Lourie & Kuiter, 2008","Pontoh's pygmy seahorse","Hipon_u3.jpg",NA,NA,NA,258,"Hippocampinae",5566,NA,"other","O",NA,NA,0,0,0,-1,"benthopelagic","non-migratory",NA,8,25,79848,NA,NA,NA,NA,NA,NA,NA,10,1.69,"SL",1.6,"SL",79848,NA,NA,NA,NA,NA,NA,NA,NA,NA,NA,NA,NA,NA,NA,NA,NA,NA,"",NA,"","",0,0,0,0,0,0,0,0,0,0,"never/rarely","",NA,"never/rarely",NA,"never/rarely","",NA,0,NA,"harmless",NA,"no special ability",NA,NA,-1,"<i>Hippocampus pontohi</i> has been observed on the coralline algae <i>Halimeda</i>, as well as on the hydroid <i>Aglaephenia cupressina</i> (Müller and Severns, pers. comm.). Severns noted it particularly in areas where <i>Halimeda</i> is growing on reef walls. It has been recorded at a number of areas in Indonesia (Bunaken, Cape Sri, Sorong, Wakatobi, Lembeh Straits), at depths of between 11-25 m particularly on vertical walls or in rock fissures on current-swept walls where it will tend to occur on the side of the fissure that faces away from the current, but in all cases where there is some upward current (Müller, pers. comm.) and has been seen swimming over a fungiid coral (Hardt, pers. comm.).  <i>Hippocampus pontohi</i> is commonly found in pairs and, like <i>H. denise</i>, is relatively active in the morning and late afternoon when it is not in direct sunlight (Müller, pers. comm.). Two of the specimens examined were pregnant and each contained approximately 11 embryos (Ref. 79848).",NA,0.5,0,1016,"2008-12-15T18:18:03.000Z",14,"2014-01-24T00:00:00.000Z",NA,NA,NA,64800
"106","Hippocampus satomiae","Hippocampus","satomiae",79848,"Lourie & Kuiter, 2008","Satomi's pygmy seahorse","Hipon_u1.jpg",NA,NA,NA,258,"Hippocampinae",5566,NA,"other","O",NA,NA,0,0,0,-1,"benthopelagic","non-migratory",NA,5,20,79848,NA,NA,NA,NA,NA,NA,NA,10,1.38,"SL",1.34,"SL",79848,NA,NA,NA,NA,NA,NA,NA,NA,NA,NA,NA,NA,NA,NA,NA,NA,NA,"",NA,"","",0,0,0,0,0,0,0,0,0,0,"never/rarely","",NA,"never/rarely",NA,"never/rarely","",NA,0,NA,"harmless",NA,"no special ability",NA,NA,-1,"<i>Hippocampus satomiae</i> congregates at night in groups of 3–5 individuals on small seafans, at depths of 15–20 m depth on the bottom below reef overhangs. During the day <i>H. satomiae</i> are difficult to find, even in areas where they are known to occur. At dawn individuals become active. At birth, the young are jet–black, about 3 mm in height and shaped similarly to the adults. They settle on the bottom near to their place of birth (Onishi, pers. comm.). The holotype, collected in October, was pregnant and carrying approximately eight young (Ref. 79848).",NA,0.5,0,1016,"2008-12-15T23:04:46.000Z",1016,"2013-07-22T00:00:00.000Z",NA,NA,NA,64802
